{
  "$schema": "https://json-schema.org/draft-07/schema#",
  "title": "CareerAgent External Provider Proof",
  "type": "object",
  "required": [
    "proof_type",
    "proof_id",
    "created_at",
    "provider",
    "provider_mode",
    "base_url_redacted",
    "embedding_model",
    "llm_model",
    "embedding_validation_passed",
    "llm_validation_passed",
    "timeout_retry_validation",
    "schema_validation_passed",
    "rag_grounded_answer_sample_passed",
    "llm_judge_sample_passed",
    "secret_leak_check_passed",
    "production_quality_candidate_signal",
    "limitations"
  ],
  "properties": {
    "proof_type": { "const": "provider" },
    "proof_id": { "type": "string", "minLength": 1 },
    "created_at": { "type": "string", "minLength": 1 },
    "provider": { "type": "string", "minLength": 1 },
    "provider_mode": { "enum": ["not_verified", "provider_verified", "failed"] },
    "base_url_redacted": { "type": "string" },
    "embedding_model": { "type": "string" },
    "llm_model": { "type": "string" },
    "embedding_validation_passed": { "type": "boolean" },
    "llm_validation_passed": { "type": "boolean" },
    "timeout_retry_validation": { "type": "boolean" },
    "schema_validation_passed": { "type": "boolean" },
    "rag_grounded_answer_sample_passed": { "type": "boolean" },
    "llm_judge_sample_passed": { "type": "boolean" },
    "secret_leak_check_passed": { "type": "boolean" },
    "production_quality_candidate_signal": { "type": "boolean" },
    "limitations": { "type": "array", "items": { "type": "string" } }
  }
}
